Datum,Start,Einde,Plaats,Omschrijving,Issue #,Opmerkingen
09/02/16,08:15,10:15,School,Uitlegsessie VOP,,
09/02/16,10:15,12:15,School,"Planning, afspraken en start product backlog",,
09/02/16,14:45,14:50,School,Initial commit and wiki page,,
09/02/16,19:40,19:55,Thuis,"Sprint #1 wiki nalezen, correcties aanbevelen en README aangevuld",,
11/02/16,13:45,15:30,School,"Vergadering tijdens springuren tussen Niels, Tomas, Thomas en Aaron. Issues en bespreking verdere planning",,
14/02/16,20:00,23:00,Thuis,"Issue's aanmaken (23, 26 en 27) + werken aan issue 26 (zie daar voor details) + dev wiki aanvullen",26,
