Datum,Start,Einde,Plaats,Omschrijving,Issue #,Opmerkingen
09/02/16,08:15,10:15,School,"Uitlegsessie VOP",,
09/02/16,10:15,12:15,School,"Documentatie project doornemen bespreken en starten product backlog",,
11/02/16,13:30,15:45,School,"Issues besproken; discussion op Git gestart ivm. Taakverdeling en project creatie; issue #8 aan mezelf toegekend",8,
11/02/16,21:00,22:30,Thuis,"Logboek aanpassen, creëren milestone, eerste opzoeking API's Here Maps",,
13/02/16,13:00,16:00,Thuis,"Installatie netbeans; downloaden maria DB, installatie GitGUI; leren werken met GIT",,
16/02/16,08:15,12:30,School,"Standup meeting, overlopen issues en issues toewijzen verschillende personen, presentatie klant bijwonen, klant bevragen",,
16/02/16,14:30,15:30,School,"Installatie en configuratie mariaDB op laptop",,
17/02/16,21:00,22:00,Thuis,"Aanvragen API-keys HereMaps; documentatie API HereMaps doornemen",,
